{"artifact_bytes":{"backtest":10646,"baskets":20349,"clv":102243,"cohorts":3816,"elasticity":4361,"facts":2813,"forecast":24298,"landscape":4620,"meta":1724,"newsvendor_params":4413,"newsvendor_scenarios":40242,"newsvendor_vectors":8411,"overview":2358,"products":13970,"reconciliation":2584,"rfm":60761,"validation":2683},"artifact_tags":{"backtest":{"design":"DERIVED","interval_coverage":"PREDICTED","pooled":"PREDICTED","win_rate":"PREDICTED"},"baskets":{"edges":"DERIVED","hero":"DERIVED","nodes":"DERIVED","params":"DERIVED","rules":"DERIVED","showcase":"DERIVED"},"clv":{"calibration":"PREDICTED","customers":"PREDICTED","deciles":"PREDICTED","final_fit":"PREDICTED","gamma_gamma_check":"DERIVED","holdout":"PREDICTED","model":"PREDICTED"},"cohorts":{"mean_curve":"DERIVED","retention":"DERIVED","revenue_retention":"DERIVED"},"elasticity":{"decision":"DERIVED","evidence":"OBSERVED"},"facts":{"facts":"OBSERVED/DERIVED/PREDICTED/SIMULATED"},"forecast":{"forecast":"PREDICTED","history":"OBSERVED","interval":"PREDICTED"},"landscape":{"revenue_gbp":"OBSERVED"},"newsvendor_params":{"assumptions":"SIMULATED","items":"OBSERVED/PREDICTED"},"newsvendor_scenarios":{"grid":"SIMULATED","policy_check":"SIMULATED","scenarios":"SIMULATED"},"newsvendor_vectors":{"vectors":"SIMULATED"},"overview":{"basket":"OBSERVED","countries":"OBSERVED","rhythm":"OBSERVED","series":"OBSERVED"},"products":{"concentration":"OBSERVED","families":"DERIVED","top_skus":"OBSERVED"},"reconciliation":{"classes":"OBSERVED","identities":"DERIVED","ledger":"OBSERVED","refunds":"DERIVED"},"rfm":{"customers":"DERIVED","definition":"DERIVED","grid":"DERIVED","segments":"DERIVED"}},"assumptions":["Unit price is GBP (the source describes a UK-registered retailer; there is no currency column).","Credit notes (invoice prefix C) are refunds; matched LIFO to earlier sales of the same customer and SKU.","Exact duplicate rows are removed (count published); some may be genuine repeated scans.","Product families are DERIVED from description keywords; the source has no category.","Newsvendor cost, salvage and review period are assumptions (SIMULATED).","CLV is revenue, discounted at an assumed 10% a year, not profit."],"currency":"GBP","disclaimers":["Online Retail II, Daqing Chen (2012), UCI Machine Learning Repository, https://doi.org/10.24432/C5CG6D, licensed CC BY 4.0. Derived aggregates, modified; not the original file.","Customers are anonymised integer keys; the source Customer IDs are never published.","Not representative of retail in general: one UK gift-ware wholesaler, 24 months, two Christmas seasons.","Analytical examples only, not business advice."],"engine":{"dbt_version":"1.11.0","duckdb_version":"1.5.6","python":"3.12.13","seed":20261011,"star_schema":"dbt-duckdb (models in dbt/): stg_raw, stg_lines, dim_product, dim_customer, dim_date, dim_country, fact_lines, fact_refund_match"},"no_demographics":"The source contains no demographic fields. None are inferred, imputed or invented.","pipeline_version":"1.0.0","retrieved_at":"2026-10-11T06:51:45+00:00","schema_version":"v1","source":{"attribution":"Online Retail II, Daqing Chen (2012), UCI Machine Learning Repository, https://doi.org/10.24432/C5CG6D, licensed CC BY 4.0. Derived aggregates, modified; not the original file.","dataset":"Online Retail II (Daqing Chen, 2012)","doi":"10.24432/C5CG6D","id":"uci_online_retail_ii","licence":"CC BY 4.0","licence_url":"https://creativecommons.org/licenses/by/4.0/","publisher":"UCI Machine Learning Repository","role":"Sole data source: every invoice line of a UK online gift-ware wholesaler, 2009-12-01 to 2011-12-09.","url":"https://archive.ics.uci.edu/static/public/502/online+retail+ii.zip"},"tags":{"engine":"OBSERVED","source":"OBSERVED"},"window":{"first_ts":"2009-12-01 07:45:00","first_week":"2009-12-07","last_complete_week":"2011-11-28","last_ts":"2011-12-09 12:50:00","weeks_complete":104}}
